### ISSUE TITLE
http_filter missing packets near end of HTTP conversation

### ISSUE THREAD

**Issue by Birch-san** [iovisor/bcc#1920]
I've followed the http_filter example, and am trying to count the bytes transferred to/from my webserver when files are downloaded via HTTP.

I successfully catch the packets at the start of the HTTP conversation (entirety of inbound HTTP request, and most packets comprising my outbound HTTP response). But frequently there are packets toward the end of my outbound HTTP response, that my packet filter doesn't log.

I used [`http-parse-complete.c`](https://github.com/iovisor/bcc/blob/master/examples/networking/http_filter/http-parse-complete.c) @ 3d9b687  
And I made my own, simple [`http-parse-seq.py`](https://gist.github.com/Birch-san/e9f21b2dc996c4405cd423527a633b2d), which does just one thing: print the sequence number of every packet that it sees.

Expected: Every sequence number I see in Wireshark/tcpdump should be logged by my bcc program also.  
Actual: later packets are often absent from my bcc program's logs, yet are visible in Wireshark/tcpdump.

Repro:

```bash
# make a directory which our webserver will mount
mkdir -p htdocs

# let's get a large photo for our webserver to serve
curl -o htdocs/docker.jpg 'https://reterwebber.files.wordpress.com/2014/09/docker-wallpaper-grey.jpg'

# launch apache webserver serving our image at http://localhost:8080/docker.jpg
docker run -i --rm --name httpd -p 8080:80 -v "$PWD"/htdocs:/usr/local/apache2/htdocs:ro,delegated


#== (meanwhile, in another terminal)
# download the bcc script
curl -o http-parse-complete.c 'https://raw.githubusercontent.com/iovisor/bcc/3d9b687/examples/networking/http_filter/http-parse-complete.c'
curl -o http-parse-seq.py 'https://gist.githubusercontent.com/Birch-san/e9f21b2dc996c4405cd423527a633b2d/raw/b91b16c5ae0705d4bc098d342c10bd0ed84f6e18/http-parse-seq.py'

# run the bcc script (logs sequence numbers of all HTTP packets inbound/outbound on docker0 interface)
sudo ./http-parse-seq.py -i docker0


#== (meanwhile, in another terminal)
# watch packets on docker0 interface
sudo tcpdump ip -Snnli docker0 -B 65536


#== (meanwhile, in another terminal)
# download photo from our website
curl -Is 'http://localhost:8080/docker.jpg'
```

I observed that my bcc script output the following sequence numbers:

```
2002486161
3240310653
3240317893
3240325133
3240335269
3240339613
3240361333
3240383053
3240404773
3240426493
3240427941
3240451109
3240474277
3240475725
3240493101
3240517717
```

Whereas tcpdump output the following:

```
15:55:12.840095 IP 172.17.0.1.54296 > 172.17.0.2.80: Flags [S], seq 2002486160, win 29200, options [mss 1460,sackOK,TS val 2846391946 ecr 0,nop,wscale 7], length 0
15:55:12.840118 IP 172.17.0.2.80 > 172.17.0.1.54296: Flags [S.], seq 3240310652, ack 2002486161, win 28960, options [mss 1460,sackOK,TS val 809068667 ecr 2846391946,nop,wscale 7], length 0
15:55:12.840132 IP 172.17.0.1.54296 > 172.17.0.2.80: Flags [.], ack 3240310653, win 229, options [nop,nop,TS val 2846391946 ecr 809068667], length 0
15:55:12.840541 IP 172.17.0.1.54296 > 172.17.0.2.80: Flags [P.], seq 2002486161:2002486253, ack 3240310653, win 229, options [nop,nop,TS val 2846391947 ecr 809068667], length 92: HTTP: GET /docker.jpg?s=1 HTTP/1.1
15:55:12.840560 IP 172.17.0.2.80 > 172.17.0.1.54296: Flags [.], ack 2002486253, win 227, options [nop,nop,TS val 809068668 ecr 2846391947], length 0
15:55:12.842392 IP 172.17.0.2.80 > 172.17.0.1.54296: Flags [.], seq 3240310653:3240317893, ack 2002486253, win 227, options [nop,nop,TS val 809068670 ecr 2846391947], length 7240: HTTP: HTTP/1.1 200 OK
15:55:12.842426 IP 172.17.0.1.54296 > 172.17.0.2.80: Flags [.], ack 3240317893, win 342, options [nop,nop,TS val 2846391949 ecr 809068670], length 0
15:55:12.842437 IP 172.17.0.2.80 > 172.17.0.1.54296: Flags [.], seq 3240317893:3240325133, ack 2002486253, win 227, options [nop,nop,TS val 809068670 ecr 2846391947], length 7240: HTTP
15:55:12.842444 IP 172.17.0.1.54296 > 172.17.0.2.80: Flags [.], ack 3240325133, win 455, options [nop,nop,TS val 2846391949 ecr 809068670], length 0
15:55:12.842452 IP 172.17.0.2.80 > 172.17.0.1.54296: Flags [.], seq 3240325133:3240335269, ack 2002486253, win 227, options [nop,nop,TS val 809068670 ecr 2846391949], length 10136: HTTP
15:55:12.842458 IP 172.17.0.1.54296 > 172.17.0.2.80: Flags [.], ack 3240335269, win 613, options [nop,nop,TS val 2846391949 ecr 809068670], length 0
15:55:12.842462 IP 172.17.0.2.80 > 172.17.0.1.54296: Flags [P.], seq 3240335269:3240339613, ack 2002486253, win 227, options [nop,nop,TS val 809068670 ecr 2846391949], length 4344: HTTP
15:55:12.842466 IP 172.17.0.1.54296 > 172.17.0.2.80: Flags [.], ack 3240339613, win 681, options [nop,nop,TS val 2846391949 ecr 809068670], length 0
15:55:12.842482 IP 172.17.0.2.80 > 172.17.0.1.54296: Flags [.], seq 3240339613:3240361333, ack 2002486253, win 227, options [nop,nop,TS val 809068670 ecr 2846391949], length 21720: HTTP
15:55:12.842490 IP 172.17.0.1.54296 > 172.17.0.2.80: Flags [.], ack 3240361333, win 1020, options [nop,nop,TS val 2846391949 ecr 809068670], length 0
15:55:12.842494 IP 172.17.0.2.80 > 172.17.0.1.54296: Flags [P.], seq 3240361333:3240383053, ack 2002486253, win 227, options [nop,nop,TS val 809068670 ecr 2846391949], length 21720: HTTP
15:55:12.842501 IP 172.17.0.1.54296 > 172.17.0.2.80: Flags [.], ack 3240383053, win 1146, options [nop,nop,TS val 2846391949 ecr 809068670], length 0
15:55:12.843435 IP 172.17.0.1.54296 > 172.17.0.2.80: Flags [F.], seq 2002486253, ack 3240383053, win 1360, options [nop,nop,TS val 2846391950 ecr 809068670], length 0
15:55:12.843605 IP 172.17.0.2.80 > 172.17.0.1.54296: Flags [.], seq 3240383053:3240404773, ack 2002486253, win 227, options [nop,nop,TS val 809068671 ecr 2846391949], length 21720: HTTP
15:55:12.843626 IP 172.17.0.1.54296 > 172.17.0.2.80: Flags [.], ack 3240404773, win 1367, options [nop,nop,TS val 2846391950 ecr 809068671], length 0
15:55:12.843634 IP 172.17.0.2.80 > 172.17.0.1.54296: Flags [.], seq 3240404773:3240426493, ack 2002486253, win 227, options [nop,nop,TS val 809068671 ecr 2846391949], length 21720: HTTP
15:55:12.843643 IP 172.17.0.1.54296 > 172.17.0.2.80: Flags [.], ack 3240426493, win 1277, options [nop,nop,TS val 2846391950 ecr 809068671], length 0
15:55:12.843647 IP 172.17.0.2.80 > 172.17.0.1.54296: Flags [.], seq 3240426493:3240427941, ack 2002486253, win 227, options [nop,nop,TS val 809068671 ecr 2846391949], length 1448: HTTP
15:55:12.843652 IP 172.17.0.1.54296 > 172.17.0.2.80: Flags [.], ack 3240427941, win 1267, options [nop,nop,TS val 2846391950 ecr 809068671], length 0
15:55:12.843662 IP 172.17.0.2.80 > 172.17.0.1.54296: Flags [.], seq 3240427941:3240451109, ack 2002486254, win 227, options [nop,nop,TS val 809068671 ecr 2846391950], length 23168: HTTP
15:55:12.843674 IP 172.17.0.1.54296 > 172.17.0.2.80: Flags [.], ack 3240451109, win 1171, options [nop,nop,TS val 2846391950 ecr 809068671], length 0
15:55:12.843679 IP 172.17.0.2.80 > 172.17.0.1.54296: Flags [.], seq 3240451109:3240474277, ack 2002486254, win 227, options [nop,nop,TS val 809068671 ecr 2846391950], length 23168: HTTP
15:55:12.843687 IP 172.17.0.1.54296 > 172.17.0.2.80: Flags [.], ack 3240474277, win 1076, options [nop,nop,TS val 2846391950 ecr 809068671], length 0
15:55:12.843691 IP 172.17.0.2.80 > 172.17.0.1.54296: Flags [.], seq 3240474277:3240475725, ack 2002486254, win 227, options [nop,nop,TS val 809068671 ecr 2846391950], length 1448: HTTP
15:55:12.843696 IP 172.17.0.1.54296 > 172.17.0.2.80: Flags [.], ack 3240475725, win 1065, options [nop,nop,TS val 2846391950 ecr 809068671], length 0
15:55:12.843700 IP 172.17.0.2.80 > 172.17.0.1.54296: Flags [P.], seq 3240475725:3240493101, ack 2002486254, win 227, options [nop,nop,TS val 809068671 ecr 2846391950], length 17376: HTTP
15:55:12.843707 IP 172.17.0.1.54296 > 172.17.0.2.80: Flags [.], ack 3240493101, win 992, options [nop,nop,TS val 2846391950 ecr 809068671], length 0
15:55:12.843737 IP 172.17.0.2.80 > 172.17.0.1.54296: Flags [.], seq 3240493101:3240517717, ack 2002486254, win 227, options [nop,nop,TS val 809068671 ecr 2846391950], length 24616: HTTP
15:55:12.843746 IP 172.17.0.1.54296 > 172.17.0.2.80: Flags [.], ack 3240517717, win 893, options [nop,nop,TS val 2846391950 ecr 809068671], length 0
15:55:12.843756 IP 172.17.0.2.80 > 172.17.0.1.54296: Flags [.], seq 3240517717:3240542333, ack 2002486254, win 227, options [nop,nop,TS val 809068671 ecr 2846391950], length 24616: HTTP
15:55:12.843765 IP 172.17.0.1.54296 > 172.17.0.2.80: Flags [.], ack 3240542333, win 791, options [nop,nop,TS val 2846391950 ecr 809068671], length 0
15:55:12.843768 IP 172.17.0.2.80 > 172.17.0.1.54296: Flags [.], seq 3240542333:3240543781, ack 2002486254, win 227, options [nop,nop,TS val 809068671 ecr 2846391950], length 1448: HTTP
15:55:12.843775 IP 172.17.0.2.80 > 172.17.0.1.54296: Flags [.], seq 3240543781:3240569845, ack 2002486254, win 227, options [nop,nop,TS val 809068671 ecr 2846391950], length 26064: HTTP
15:55:12.843787 IP 172.17.0.2.80 > 172.17.0.1.54296: Flags [P.], seq 3240569845:3240577797, ack 2002486254, win 227, options [nop,nop,TS val 809068671 ecr 2846391950], length 7952: HTTP
15:55:12.843951 IP 172.17.0.2.80 > 172.17.0.1.54296: Flags [F.], seq 3240577797, ack 2002486254, win 227, options [nop,nop,TS val 809068671 ecr 2846391950], length 0
15:55:12.843962 IP 172.17.0.1.54296 > 172.17.0.2.80: Flags [.], ack 3240577798, win 632, options [nop,nop,TS val 2846391950 ecr 809068671], length 0
```

_You can filter+parse the tcpdump to just show sequence numbers like so: `awk '$8~/seq/{gsub(/,$/,"",$9);print $9}' tcpdump.txt > tcpdump-seq.txt`_

So, the final packet that my bcc script sees, has a sequence number `3240517717`. Yet tcpdump sees three additional HTTP packets outbound from my webserver after that: `3240517717, 3240542333, 3240543781, 3240569845`.

Am I doing something wrong? Or is it expected that http_filter would not see all HTTP packets on the interface?

Versions:

```
Ubuntu 18.04 LTS
bcc-tools: 0.6.0-1
/etc/apt/sources.list.d/iovisor.list:
deb https://repo.iovisor.org/apt/artful artful main
```

I wasn't sure what the "max packet length on the docker0 interface" was, so I used the MTU of loopback (65536) as a generous upper bound.

I attach some packet captures, including tcpdump, wireshark (pcap, pcapng) and the output of my program.

[log_http.tar.gz](https://github.com/iovisor/bcc/files/2281095/log_http.tar.gz)

**Comment by yonghong-song** [comment]
You can add some debug `bpf_trace_printk` which will log the events in the /sys/kernel/debug/tracing/trace_pipe, and you can check whether all packets reach bpf program or not.

**Comment by Birch-san** [comment]
@yonghong-song thanks very much for that tip!

it's confirmed that _we really are losing packets_ (between the C program and the Python program).

I've told the C program to trace sequence numbers:

```c
//send packet to userspace returning -1
KEEP:
bpf_trace_printk("KEEP %u\n", tcp->seq_num);
return -1;
```

Let's see how the kernel trace compares with the sequence numbers output by the Python program:

```
cat /sys/kernel/debug/tracing/trace_pipe                                | http_parse_seq.py 
===========================================================================================
                                                                        |                  
docker-proxy-4292  [000] ....  4741.207629: 0x00000001: KEEP 2280867380 | 2280867380       
       httpd-4421  [000] ..s1  4741.207842: 0x00000001: KEEP 1735680703 | 1735680703       
       httpd-4421  [000] ..s1  4741.207858: 0x00000001: KEEP 1735687943 | 1735687943       
       httpd-4421  [000] ..s1  4741.207868: 0x00000001: KEEP 1735695183 | 1735695183       
       httpd-4421  [000] ..s1  4741.207874: 0x00000001: KEEP 1735705319 | 1735705319       
       httpd-4421  [000] ..s1  4741.207896: 0x00000001: KEEP 1735709663 | 1735709663       
       httpd-4421  [000] ..s1  4741.207901: 0x00000001: KEEP 1735731383 | 1735731383       
       httpd-4421  [000] ..s1  4741.207921: 0x00000001: KEEP 1735753103 | 1735753103       
       httpd-4421  [000] ..s1  4741.207931: 0x00000001: KEEP 1735774823 | 1735774823       
       httpd-4421  [000] ..s1  4741.207938: 0x00000001: KEEP 1735796543 | 1735796543       
       httpd-4421  [000] ..s1  4741.207949: 0x00000001: KEEP 1735797991 | 1735797991       
       httpd-4421  [000] ..s1  4741.207957: 0x00000001: KEEP 1735821159 | 1735821159       
       httpd-4421  [000] ..s1  4741.207963: 0x00000001: KEEP 1735844327 | 1735844327       
       httpd-4421  [000] ..s1  4741.207969: 0x00000001: KEEP 1735845775 | 1735845775       
       httpd-4421  [000] ..s1  4741.207991: 0x00000001: KEEP 1735863151 | 1735863151       
docker-proxy-4292  [000] ..s1  4741.208161: 0x00000001: KEEP 1735887767 |                  
docker-proxy-4292  [000] ..s1  4741.208163: 0x00000001: KEEP 1735912383 |                  
docker-proxy-4292  [000] ..s1  4741.208188: 0x00000001: KEEP 1735936999 |                  
```

The Python program does not receive the final 3 packets!

The obvious questions are:

- why does the kernel trace attribute the tail of the conversation to docker-proxy?
- why do the docker-proxy packets in the tail, fail to reach the Python program?

**Comment by Birch-san** [comment]
I'm experiencing similar results even when I simplify the experiment.

I launched a (non-Dockerized) apache2 service locally, and attached BPF raw socket to `lo` interface.

Sequence numbers printed when I make a curl request to local apache2:

```
cat /sys/kernel/debug/tracing/trace_pipe                      | http_parse_seq.py 
===========================================================================================
   curl-13570 [000] .... 10044.327504: 0x00000001: 306974184  | 306974184
   curl-13570 [000] ..s1 10044.327522: 0x00000001: 306974184  | 306974184
apache2-13210 [000] .... 10044.327748: 0x00000001: 4004211662 | 4004211662
apache2-13210 [000] ..s1 10044.327759: 0x00000001: 4004211662 | 4004211662
apache2-13210 [000] .... 10044.327768: 0x00000001: 4004233550 | 4004233550
apache2-13210 [000] ..s1 10044.327769: 0x00000001: 4004233550 | 4004233550
   curl-13570 [000] ..s1 10044.328952: 0x00000001: 4004255438 | 4004255438
   curl-13570 [000] ..s1 10044.328962: 0x00000001: 4004277326 | 4004277326
   curl-13570 [000] ..s1 10044.328964: 0x00000001: 4004299214 | 4004299214
   curl-13570 [000] ..s1 10044.328966: 0x00000001: 4004321102 | 4004321102
   curl-13570 [000] ..s1 10044.328968: 0x00000001: 4004342990 | 4004342990
   curl-13570 [000] ..s1 10044.328970: 0x00000001: 4004364878 | 4004364878
   curl-13570 [000] ..s1 10044.328971: 0x00000001: 4004255438 | 4004255438
   curl-13570 [000] ..s1 10044.328973: 0x00000001: 4004277326 |
   curl-13570 [000] ..s1 10044.328974: 0x00000001: 4004299214 |
   curl-13570 [000] ..s1 10044.328975: 0x00000001: 4004321102 |
   curl-13570 [000] ..s1 10044.328976: 0x00000001: 4004342990 |
   curl-13570 [000] ..s1 10044.328976: 0x00000001: 4004364878 |
   curl-13570 [000] ..s1 10044.328982: 0x00000001: 4004386766 |
   curl-13570 [000] ..s1 10044.328984: 0x00000001: 4004408654 |
   curl-13570 [000] ..s1 10044.328986: 0x00000001: 4004430542 |
   curl-13570 [000] ..s1 10044.328988: 0x00000001: 4004452430 |
   curl-13570 [000] ..s1 10044.328989: 0x00000001: 4004474318 |
   curl-13570 [000] ..s1 10044.328990: 0x00000001: 4004386766 |
   curl-13570 [000] ..s1 10044.328991: 0x00000001: 4004408654 |
   curl-13570 [000] ..s1 10044.328992: 0x00000001: 4004430542 |
   curl-13570 [000] ..s1 10044.328993: 0x00000001: 4004452430 |
   curl-13570 [000] ..s1 10044.328994: 0x00000001: 4004474318 |
```

What's going on? Why is it that the Python program does not see every packet that the C program sees?

**Comment by Birch-san** [comment]
I replaced my Python program's while loop with a `bpf.trace_print()`, and I get these sequence numbers printed when in C vs in Python when I make a curl request to local apache2:

```
cat /sys/kernel/debug/tracing/trace_pipe                      | http_parse_seq.py 
===========================================================================================
                                                              |    curl-13593 [000] .... 10486.518823: 0x00000001: 2258361507
                                                              |    curl-13593 [000] ..s1 10486.518837: 0x00000001: 2258361507
                                                              | apache2-13212 [000] .... 10486.519071: 0x00000001: 3713105088
                                                              | apache2-13212 [000] ..s1 10486.519073: 0x00000001: 3713105088
                                                              | apache2-13212 [000] .... 10486.519081: 0x00000001: 3713126976
                                                              | apache2-13212 [000] ..s1 10486.519082: 0x00000001: 3713126976
curl-13593 [000] ..s1 10486.519604: 0x00000001: 3713148864    | 
curl-13593 [000] ..s1 10486.519616: 0x00000001: 3713170752    | 
curl-13593 [000] ..s1 10486.519618: 0x00000001: 3713192640    | 
curl-13593 [000] ..s1 10486.519620: 0x00000001: 3713214528    | 
curl-13593 [000] ..s1 10486.519631: 0x00000001: 3713236416    | 
curl-13593 [000] ..s1 10486.519633: 0x00000001: 3713258304    | 
curl-13593 [000] ..s1 10486.519634: 0x00000001: 3713148864    | 
curl-13593 [000] ..s1 10486.519636: 0x00000001: 3713170752    | 
curl-13593 [000] ..s1 10486.519637: 0x00000001: 3713192640    | 
curl-13593 [000] ..s1 10486.519637: 0x00000001: 3713214528    | 
curl-13593 [000] ..s1 10486.519638: 0x00000001: 3713236416    | 
curl-13593 [000] ..s1 10486.519639: 0x00000001: 3713258304    | 
curl-13593 [000] ..s1 10486.519646: 0x00000001: 3713280192    | 
curl-13593 [000] ..s1 10486.519648: 0x00000001: 3713302080    | 
curl-13593 [000] ..s1 10486.519650: 0x00000001: 3713323968    | 
curl-13593 [000] ..s1 10486.519651: 0x00000001: 3713345856    | 
curl-13593 [000] ..s1 10486.519653: 0x00000001: 3713367744    | 
curl-13593 [000] ..s1 10486.519654: 0x00000001: 3713280192    | 
curl-13593 [000] ..s1 10486.519655: 0x00000001: 3713302080    | 
curl-13593 [000] ..s1 10486.519656: 0x00000001: 3713323968    | 
curl-13593 [000] ..s1 10486.519657: 0x00000001: 3713345856    | 
curl-13593 [000] ..s1 10486.519658: 0x00000001: 3713367744    | 
```

Not sure what I was expecting `bpf.trace_print()` to do, but looks like there's a mutual exclusion; Python gets first dibs on tracing packets, until packets cease to be attributed to apache2 (and thereafter only C traces anything).

**Comment by Birch-san** [comment]
Is it possible that events are not passed to the BPF program because there is a limit to how many kretprobes can be triggered concurrently?

https://github.com/iovisor/bcc/issues/1072

**Comment by yonghong-song** [comment]
There is a way to specify `maxactive` in the newer kernels,
```
r[maxactive][:[<group>/]<event>] <place> [<args>]
```
4.18 official release supports it. I did not check whether the
previous releases support it or not.

**Comment by yonghong-song** [comment]
Regarding to why bpf kernel program gets 14 packets and bpf user space program gets 10 packets. It is more like that kernel drops the packet. Note that kernel bpf program merely decides whether to drop the packet or not, it does not pass the packet to the kernel through bpf subsystem (e.g., perf_event ring buffer).

After bpf program execution is done for a particular packet, the normal linux networking stack will continue to process the packet. It is totally possible that the packet is dropped there and the user space won't be able to receive it. One way to verify is that to have bpf program does not do
anything and simply returns pass (-1) and to see how many packets user space received.

**Comment by Birch-san** [comment]
@yonghong-song thanks very much for replying.
I'm not sure where to put that line of kernel config. Well, maybe I am not using kretprobes at all; I run `BPF.attach_raw_socket()` instead of `mybpf.attach_kprobe()` or similar.

I've now trimmed down the program to the bare minimum (just allow TCP through, and `bf_trace_printk()` the sequence number):

https://gist.github.com/Birch-san/f9a54a87f806fd7b20f2812dbb4d4da7

But even with this minimal program: I'm still missing TCP packets:

```
cat /sys/kernel/debug/tracing/trace_pipe                           | http-minimal.py 
===========================================================================================
docker-proxy-14163 [000] .... 22959.109475: 0x00000001: 2794955767 | 2794955767
docker-proxy-14163 [000] ..s1 22959.109510: 0x00000001: 4204525079 | 4204525079
docker-proxy-14163 [000] .... 22959.109519: 0x00000001: 2794955768 | 2794955768
docker-proxy-14163 [000] .... 22959.110097: 0x00000001: 2794955768 | 2794955768
docker-proxy-14163 [000] ..s1 22959.110133: 0x00000001: 4204525080 | 4204525080
       httpd-14261 [000] ..s1 22959.110364: 0x00000001: 4204525080 | 4204525080
       httpd-14261 [000] ..s1 22959.110374: 0x00000001: 2794955856 | 2794955856
       httpd-14261 [000] ..s1 22959.110383: 0x00000001: 4204532320 | 4204532320
       httpd-14261 [000] ..s1 22959.110388: 0x00000001: 2794955856 | 2794955856
       httpd-14261 [000] ..s1 22959.110397: 0x00000001: 4204539560 | 4204539560
       httpd-14261 [000] ..s1 22959.110401: 0x00000001: 2794955856 | 2794955856
       httpd-14261 [000] ..s1 22959.110405: 0x00000001: 4204549696 | 4204549696
       httpd-14261 [000] ..s1 22959.110408: 0x00000001: 2794955856 | 2794955856
       httpd-14261 [000] ..s1 22959.110428: 0x00000001: 4204554040 | 4204554040
       httpd-14261 [000] ..s1 22959.110432: 0x00000001: 2794955856 | 2794955856
       httpd-14261 [000] ..s1 22959.110436: 0x00000001: 4204575760 | 4204575760
       httpd-14261 [000] ..s1 22959.110439: 0x00000001: 2794955856 | 2794955856
       httpd-14261 [000] ..s1 22959.110464: 0x00000001: 4204597480 | 4204597480
       httpd-14261 [000] ..s1 22959.110467: 0x00000001: 2794955856 | 2794955856
       httpd-14261 [000] ..s1 22959.110486: 0x00000001: 4204640920 | 4204640920
       httpd-14261 [000] ..s1 22959.110489: 0x00000001: 2794955856 | 2794955856
       httpd-14261 [000] ..s1 22959.110503: 0x00000001: 4204684360 | 4204684360
       httpd-14261 [000] ..s1 22959.110529: 0x00000001: 4204749520 | 
docker-proxy-14163 [000] .... 22959.110712: 0x00000001: 2794955856 | 
docker-proxy-14163 [000] ..s1 22959.110723: 0x00000001: 4204786504 | 
docker-proxy-14163 [000] .... 22959.110749: 0x00000001: 2794955856 | 
docker-proxy-14163 [000] .... 22959.110800: 0x00000001: 2794955856 | 
docker-proxy-14163 [000] .... 22959.111374: 0x00000001: 2794955856 | 
       httpd-14262 [000] ..s1 22959.111439: 0x00000001: 4204792224 | 
       httpd-14262 [000] ..s1 22959.111448: 0x00000001: 2794955857 | 
```

This isn't quite what you suggested (i.e. return -1 under _all_ circumstances), but it's the minimum amount of code required to extract the sequence number for purposes of `bf_trace_printk()`.

I guess I could use tcpdump / Wireshark instead to grab the sequence number. then I really could just return -1 indiscriminately.

But this possibility is interesting:

> After bpf program execution is done for a particular packet, the normal linux networking stack will continue to process the packet. It is totally possible that the packet is dropped there and the user space won't be able to receive it.

So it's possible for the networking stack to (after BPF exection): drop a packet in such a way that curl receives it, but the userspace Python program does not?

**Comment by pchaigno** [comment]
@Birch-san If you're using a kernel 4.7 or older, you could use [this bcc script](https://gist.github.com/pchaigno/44d09feff60e5e92416a8b88bfee5501) to track at which kernel functions packets are dropped.

**Comment by Birch-san** [comment]
@pchaigno thanks very much for that tip!
I've rewritten that script as a [bpftrace](https://github.com/iovisor/bpftrace) one-liner:

```bash
sudo bpftrace -e 'tracepoint:skb:kfree_skb { @[sym(args->location)] = count() } interval:s:1 { print(@); clear(@) }'
```

and it reveals that these kernel functions free socket buffers during my test:

```
@[tcp_v4_rcv]: 1
@[sk_stream_kill_queues]: 1
@[unix_stream_connect]: 2
@[packet_rcv]: 3
```

are any of those unexpected / firing earlier than expected?

I don't really understand how bcc can be used to reason about packets in user-space, if there's no guarantee that all packets will actually reach userspace. am I doing something wrong here?

**Comment by Birch-san** [comment]
is `BPF.SOCKET_FILTER + BPF.attach_raw_socket()` a non-viable way to intercept HTTP traffic in userspace?
could I achieve the same thing using TCP tracepoints? would it work better?

**Comment by schrepfler** [comment]
So the kernel frees the buffers before everything is pushed/pulled from userspace?

**Comment by schrepfler** [comment]
Are these buffers copies of other buffers? Wouldn't the final recipient of the network stream also miss out on these bytes as if I understand correctly eBPF is in between the socket buffer and the client application?

**Comment by Birch-san** [comment]
certainly, if we accept that the kernel discards skbs, then there are only these ways to explain why the client application still receives every skb:

- the kfree_skb that we traced happens *after* client receives skb
  - in which case.. if we accept that our Python program is supposed to sit _between_ socket and client, then that would imply that BPF is simply failing to send the skb to us (i.e. skb is not discarded, but BPF is not behaving as expected)
- the kfree_skb that we traced is just talking about a copy, perhaps made for BPF purposes.

**Comment by schrepfler** [comment]
Can this `error during delete from bpf map` be a manifestation of that?
```
sudo python2 http-parse-complete.py  -i lo

binding socket to 'lo'
GET /test HTTP/1.1
GET /test HTTP/1.1
error during delete from bpf map 
```
Ubuntu 18.04.2 LTS on kernel 4.18.0-15-generic

**Comment by Birch-san** [comment]
I don't find that error particularly suspicious. my own simple [`http-parse-seq.py`](https://gist.github.com/Birch-san/e9f21b2dc996c4405cd423527a633b2d) doesn't make any attempt to clean up the bpf_sessions map, and is still a victim to packet loss.

it's hard to understand the range of circumstances in which `http-parse-complete.py` can throw that particular message. there's only one way to insert a session into the map ([`http-parse-complete.c#L144`](https://github.com/iovisor/bcc/blob/master/examples/networking/http_filter/http-parse-complete.c#L144)), but `http-parse-complete.py` has many ways to _delete_ sessions from the map (including 30-sec timeout). so I'm more inclined to believe that a double-delete occurred (due to an edge case in very complex code) or that the map key was calculated incorrectly in the Python program. I don't think it's likely that things are _disappearing_ from the map, or that it's BPF's fault.

**Comment by pchaigno** [comment]
> 10 is the default value for maxactive, so maybe that's no coincidence.
> 
> How can I reconfigure maxactive? There is a clue here, but I don't know how to do this in Python, nor what kretprobes the http_filter example uses.

@Birch-san I just opened #2224 which exposes `maxactive` in bcc. You can configure it through `BPF.attach_kretprobe(..., maxactive=...)`. Could you check whether a higher maxactive value solves your issue? You'll need a kernel >= 4.12.

**Comment by Birch-san** [comment]
@pchaigno I think my original understanding was flawed; my BPF program attaches to a raw socket using `BPF.attach_raw_socket()`, and does not attach to any kretprobe. So, I think kretprobe maxactive is not applicable here. My packet loss must be caused by something else.

Thanks for spreading the word though; it's good to see longstanding issues confronted.

**Comment by pchaigno** [comment]
@Birch-san Ah, right. Sorry about that. After #2224, I searched for issues mentioning maxactive to see whether the pull request could help, and I clearly was a bit too quick here.
